Продукт;Раз в неделю;Ем;Описание
Анчоусы;1;ДА;КУПЛЕННЫЕ В СВЕЖЕМ ВИДЕ И ПРИГОТОВЛЕННЫЕ ПРАВИЛЬНО. Мясо сочное и нежное. Ценность заключается в неимоверной жирности. Состоит на 14% из жира и на 25% из белка. Богаты витаминами и минеральными веществами (йод, фосфор).
Белоглазка;-;ДА;"Не представляет особой гастрономической ценности. Содержит много мелких костей. Но особенно вкусна в сушеном, вяленом виде. Так же идет на приготовление ухи, жарение и копчение"
Белый Амур;-;ДА;Считается не костлявой рыбой. Богата витаминами Е, С, А и группы В, а также различными элементами (калий, натрий, кальций, фосфор, магний). Поддерживает работу мозга, сердечной и сосудистой систем. Кроме всего этого, вещества, содержащиеся в филе белого амура, улучшают состояние кожи, нервной системы, улучшает метаболизм жиров.
Берикс;-;ДА;Сдержит в себе витамины: РР, В2. Минеральные вещества: никель, молибден, фтор, хром, хлор, фосфор, калий, натрий, магний, кальций.
Бычки;-;ДА;Содержит усваиваемые белки, необходимые макро- и микроэлементы (кальций, молибден, железо, цинк, хром, фтор и др.), целый ряд витаминов (А,В,С,Е,D). Наличие жирных полиненасыщенных кислот класса омега-3 и омега-6 способствует регулированию обмена веществ, замедлению старения организма, является профилактикой сердечно-сосудистых заболеваний.
Вобла;-;ДА;"Содержит насыщенные жирные кислоты, витамины группы В и С, а так же макроэлементы: фосфор, хлор, натрий, кальций. Микроэлементы: молибден, никель."
Водоросль вакаме;-;ДА;"В водоросли содержатся витамины в большем количестве: холин, РР, К, В9, А, бета-каротин, минеральные вещества: марганец, медь, железо, фосфор, калий, натрий, магний, кальций, йод. В достаточном количестве присутствует клетчатка. Так же содержится природный антиоксидант, способствующий образованию протеинов и жирных кислот омега-3, что является профилактикой от инсультов, инфарктов, болезней сосудов."
Голавль;-;ДА;ОЧЕНЬ КОСТЛЯВЫЙ. Содержит протеины и ненасыщенные жиры, цинк и фосфор, кальций и железо, а также витамины группы В и витамин D. Быстро и легко усваивается.
Голец;1;ДА;"Мясо красное, представитель лососевых."
Горбуша;1;ДА;В горбуше содержатся в небольших количествах практически все микроэлементы и витамины. Витамины: PP, B1, E, B2, D, A, B12, B5, C, B6. Макроэлементы: кальций, сера, калий, магний, хлор, натрий, фосфор. Микроэлементы: железо, никель, цинк, селен, кобальт, йод, молибден, фтор, медь, марганец, хром. К тому же в горбуше присутствуют полиненасыщенные жирные кислоты (омега-3), которые отвечают за процессы старения.
Дорадо (морской карась);-;ДА;"Богата полиненасыщенными жирными кислотами (омега-3). Полна витаминами: B1, B5, A, B12, PP, B2, B9, B6. Химические элементы: йод (высокое содержание), калий, марганец, кальций, цинк, магний, медь, селен, натрий, фосфор."
Ерш;-;ДА;Макро- и микроэлементы: цинк, хром, фтор, молибден, никель, хлор. Витамин РР. Много белков (17,5%). Содержит сбалансированный состав аминокислот.
Зубатка;1;ДА;Мясо зубатки богато тиамином, рибофлавином, пиридоксином, пантотеновой и никотиновой кислотами, а также  аминокислотами - лизин, глутаминовая и аспарагиновая. Обладает легкой усвояемостью, НО оно содержит холестерин. Витамины: B1, C, B6, E, PP, B2, A, B12, D. Макроэлементы: кальций, натрий, сера, магний, хлор, фосфор, калий. Микроэлементы : хром, цинк, никель, железо, кобальт, йод, молибден, фтор, медь, марганец. Рекомендовано для людй с заболеваниями щитовидной железы.
Кальмар;-;НЕТ;Мясо кальмара содержит белок, хорошо усваиваемый организмом, и не содержит насыщенные жирные кислоты. Также богато таурином, который способствует снижению уровня «плохого» холестерина в крови, стабилизирует кровяное давление, уменьшает риск сердечно-сосудистых заболеваний. Содержащиеся в моллюске витамин Е и селен благотворно сказываются на выведении из организма солей тяжелых металлов, йод способствует нормализации работы щитовидной железы. Богаты витаминами C, E, PP, группы B. После варки сохраняются йод, железо, медь, фосфор – основные минеральные вещества. Содержит аминокислоту – таурин.
Камбала;-;ДА;Содержит до 20% легкоусваиваемых белков с хорошо сбалансированным набором аминокислот, и не более 3% жира. Большой ассортимент витаминов (А, группы В, Е, РР и др.), микроэлементов (калий, фосфор, кальций, магний, йод и др.), макроэлементов (селен, медь, цинк и др.). Введение камбалы в рацион повысит иммунитет и работоспособность, а уровень холестерина снизит, улучшит состояние зубов, кожи и волос, благоприятно отразится на работе щитовидной железы, ЖКТ и сердечно-сосудистой системы.
Каракатица;-;НЕТ;Содержит огромное количество полезных веществ: витамины А, В6, Е, В12, D, жирные кислоты омега-3 и омега-6, а также селен, калий, медь, фосфор, железо, йод, цинк и практически все аминокислоты, необходимые организму человека.
Карась;-;ДА;Содержит до 18 % легкоусвояемого белка, в том числе незаменимые аминокислоты, жирорастворимые витамины (С, А, Е, D) и витамины группы В, РР, никель, молибден, магний, фтор, натрий, хром, калий, железо, хлор, йод, медь, цинк, марганец, фосфор и кальций. Важный продукт питания в рационе беременных женщин, кормящих матерей, детей, ослабленных больных, а также людей, подвергающихся повышенной интеллектуальной и физической нагрузке. В составе мяса карася присутствует до 8 % полиненасыщенных жирных кислот, играющих первостепенное значение в профилактике и лечении сердечно-сосудистых и нервных заболеваний.
Карп;-;ДА;Эта рыба богата витаминным комплексом (провитамином А, С, Е, группы В, РР), антиоксидантами, и многими макро- и микроэлементами (цинком, магнием, фосфором, йодом, марганцем, никелем, медью, калием, кальцием, железом и др.). Рекомендуют употреблять тем, у кого проблемы со спинным или головным мозгом. Употребление в пищу этой рыбы эффективно для здоровья слизистых оболочек и кожи, нормализует уровень сахара в крови, благотворно воздействует на пищеварительную и нервную системы. Полезна при заболеваниях щитовидной железы.
Кета;1;ДА;Содержит: ретинол, кальциферол, тиамин, пиридоксин, рибофлавин, ниацин, цианоколобамин, аскорбиновая и фолиевая кислоты. Витамины: PP, A, H, B1, E, B2, D, B5. Микро и макро элементы: кальций, фосфор, калий, никель, молибден, хром, цинк, хлор, сера, магний, натрий, фтор, железо.
Кефаль;-;ДА;Ее мясо богато белками, жирами, кальцием, фосфором, цинком, хлором, хромом, молибденом, фтором (стимулирует рост волос и ногтей, нормализует кроветворение, укрепляет иммунитет), никелем, никотиновой кислотой, провитамином А и витамином В1. Также содержит керотин и ретинол.
Корюшка;-;ДА;В период весеннего авитаминоза эта рыбка становится источником необходимых витаминов (А, D, группы В), большого числа минералов и микроэлементов (кальций, калий, фосфор, натрий, магний, фтор, молибден, хлор, железо).
Краб;-;ДА;В мясе краба много ценного белка, лецитин, многие макро- и микроэлементы (йод, фосфор, медь, железо, сера, цинк, калий, кальций) и витаминов (Е, РР, В12, С, B3, B1, A, B9, B2, B6, B5). Содержит большое количество аминокислоты таурина, являющейся антиоксидантом. Таурин способствует нормальному функционированию мышц и кровеносных сосудов, а также благоприятно воздействует на зрение человека (улучшает состояние сетчатки глаз, роговицы и укрепляет глазные мышцы). Содержит полиненасыщенные жирные кислоты омега-6 и омега-3, снижающие уровень холестерина в крови человека и таким образом препятствующие развитию сердечно-сосудистых заболеваний (атеросклероз, гипертоническая болезнь, анемии) и возникновению онкологических патологий.
Креветка;-;ДА;Является источником ценного белка и кальция. Высокое содержание витаминов (С, РР, Е, B1, B2, B5, B6, B9) и микроэлементов (кальций, калий, железо, магний, фосфор, фтор) благоприятно воздействует на обмен веществ в организме, укрепляет кости и мышцы, поддерживает нормальное функционирование желез внутренней секреции и стимулирует работу иммунной системы. Мясо креветок регулирует нормальное функционирование эмоционально-психической деятельности человека, а также содержит таурин, который укрепляет скелетные мышцы, стенки сосудов и благоприятно воздействует на зрительный анализатор.
Ледяная рыба;-;ДА;Употребление данного продукта полезно для организма. Это неудивительно, поскольку ледяная рыба богата витаминами, макро- и микроэлементами, которые влияют на организм благотворно. К ним следует отнести B1, B2, PP, B6, B9, хром, магний, кобальт, натрий, йод, калий, сера.
Лещ;-;ДА;Лещи содержат до 9 % рыбьего жира – ценного источника омега-3 полиненасыщенных жирных кислот, витамина Е, А и D. Эти вещества снижают уровень атерогенного холестерина в крови, способствуют рассасыванию бляшек даже при запущенном атеросклерозе и снижают риск возникновения осложнений при сердечно-сосудистых заболеваниях. Витамин D и кальций укрепляют опорно-двигательный аппарат, витамин А улучшает остроту зрения и состояние сетчатой оболочки глаза, а калий и магний благотворно влияют на работу сердца. Протеины мяса леща содержат почти все незаменимые аминокислоты, необходимые человеческому организму, а также витамины группы В и РР, минеральные вещества (никель, молибден, фтор, хром, железо, хлор, фосфор, натрий, магний, кальций).
Линь;-;ДА;Содержит витамины А, Е, С, РР, группы В. В составе много макроэлементов – натрия, магния, калия, кальция, фосфора. Микроэлементы: йод, железо, медь, цинк, марганец, хром, фтор и пр.
Лобстер;-;ДА;Содержит протеин, холестерин, а так же витамины: холин, РР, Е, В9, В5, А и другие. И минеральные вещества в большем количестве: селен, медь, цинк, фосфор, калий, натрий, магний, кальций. Мясо лобстера довольно тяжёлое для усвоения.
Лосось;1;ДА;Мясо лосося богато В1, В2, С, Е, РР, А, калием, фосфором, магнием, хлором, цинком и другими полезными элементами. Его часто употребляют для улучшения самочувствия и настроения, для профилактики раковых болезней, для улучшения работы сердечно-сосудистой системы.
Мидии;-;НЕТ;Обладают положительным эффектом для пищеварения. Содержат витамины группы B, А, С, К, Е. Микроэлементы: селен, марганец, медь, а также железо, цинк. Также присутствуют калий, магний, натрий, фосфор, кальций.   НО !!! Старые мидии могут содержать сакситоксин, которым можно отравиться!!!
Минтай;-;ДА;Богат витаминами (А, РР, группа В, Е, С), легко усваиваемыми белками, полиненасыщенными жирными кислотами, минеральными веществами ( кальций, хлор, магний, калий, сера, железо, цинк, йод, медь). Количества йода в 100 граммах мяса минтая удовлетворяет суточную потребность человеческого организма на 100%, хрома - на 110%, а кобальта на 150%. Рекомендован при патологиях щитовидной железы, атеросклерозе, для улучшения состояния слизистых оболочек и кожи, работы сердечно-сосудистой системы, в детском и диетическом питании, беременным.
Моллюск рапана;-;НЕТ;Содержит легкоусвояемый белок, аминокислоты, нужные для работы головного мозга и для снабжения мышечной ткани энергией. Витамины А, РР, Е. Минеральные вещества: железо, натрий, магний, кальций, фосфор, йод. Способствуют обмену веществ, нормальной работе почек, обеспечивают полноценную деятельность нервной системы, поддерживают зрение, повышают иммунитет, положительно влияют на процесс кроветворения, поддерживают работу сердца и сосудов.
Морской гребешок;-;НЕТ;Содержит витамин PP, никель, молибден, фтор, цинк, хлор и др.
Морской язык;-;ДА;Нормализует обмен веществ, выводит токсины, улучшает состояние кровеносных сосудов. Содержит йод, медь, фтор, серу, хлор, фосфор, калий, натрий, магний, витамин А.
Муксун;-;НЕТ;Жир, которым так богат муксун, необходим человеческому организму для полноценной деятельности внутренних органов.Жир муксуна не оказывает пагубного влияния на состояние кровеносных сосудов и сердечной мышцы. Муксун богат витаминами РР и многими минералами, особенно молибденом, хромом, фтором, хлором, цинком и никелем.
Навага;-;ДА;Мелкие кости отсутствуют. Содержит большое количество селена (очень важного для наших нервов и иммунной системы), йода, витаминов D, А, В9, Е, а также жирные насыщенные кислоты. Все эти вещества очень помогают нашему организму в формировании костей, образовании красных кровяных телец, иммунитету, борются с холестерином.
Налим;-;ДА;Питательность мяса налима обусловлена высококачественным, усваиваемым на 98% белком, содержащим семь незаменимых аминокислот. Присутствует набор витаминов, таких как А, группы В, С, D, Е. Велико содержание витаминов А и D в печени, состоящей на 50-65% из жира и являющейся поставщиком полиненасыщенных омега-3 жирных кислот, широко представлены микроэлементы - калий, кальций, магний, фосфор и др. Употребление мяса и печени налима сокращает риск сердечно-сосудистых и неврологических заболеваний, предотвращает образование холестериновых бляшек, повышает иммунитет, усиливает умственные способности, улучшает зрение и состояние зубов и кожи. Облегчает состояния при сахарном диабете, артрите, остеопорозе.
Нельма;-;ДА;Содержит легкоусвояемый белок, сбалансированный состав аминокислот и жиров. Витамины: РР, В12, В9, В6, Е. Минеральные вещества: селен, фосфор, натрий, магний, кальций, калий.
Нерка;1;ДА;Витамины: A, группы В, Е, РР, С, D, К. Микроэлементы: железо, фтор, цинк, хром, молибден, никель. Макроэлементы: магний, кальций, натрий, калий, хлор, фосфор. Нормализует процесс обмена веществ, восстановливает баланс питательных веществ и микроэлементов. Природный антиоксидант, регулирует уровень сахара в крови. Не рекомендована при наличии язвы желудка.
Окунь морской;1;ДА;Содержит достаточно много рыбьего жира с большим количеством омега-3 полиненасыщенных жирных кислот, регулирующих обмен веществ, снижающих уровень холестерина в крови и особенно необходимых в профилактике и лечении сердечно-сосудистых и нервных болезней. Отличный источник легкоусвояемого протеина со значительной долей аминокислоты таурина, влияющей на построение клеток и тканей организма и участвующей в обменных процессах.
Окунь речной;-;ДА;Содержит многие необходимые организму микроэлементы: железо, калий, магний, кальций, бор, медь, кобальт, марганец, фосфор и бром.
