Продукт;Раз в неделю;Ем;Описание
Осетр;1;ДА;Осетрина-достаточно жирное мясо,но при этом очень полезное. Содержит большое количество легкоусвояемого белка со сбалансированным аминокислотным составом, полиненасыщенных жирных кислот, необходимых людям с сердечно-сосудистыми и нервными заболеваниями, жирорастворимых витаминов, макро- и микроэлементов. Осетр содержит в большом количестве фосфор, магний, калий, натрий, кальций, железо и др. элементы. Также присутствуют витамины А, Е, C, PP, B1, B2. Витамин А нужен людям со снижением остроты зрения, витамин D, кальций и фосфор – детям и беременным женщинам, витамин Е и микроэлементы – пожилым людям и ослабленным больным. Осетр полезен для уменьшения в крови холестерина. Уменьшает риск получения инфаркта миокарда.
Осьминог;-;НЕТ;Содержится большое количество белка, полезных элементов (магний, кальций, натрий, калий, железо, фосфор, медь, селен, цинк и марганец), витаминов группы В, А, С, Е, К, РР, а также омега-3 и фосфорной кислоты.
Пангасиус;-;НЕТ;"В его состав входят витамины группы В, а также витамины А, С и Е"
Патуссу;-;НЕТ;Содержатся витамины D и А, кобальт, марганец, йод, фосфор, фтор, сера и натрий.
Пеленгас;-;НЕТ;Средней жирности, очень питательный, содержит большое количество легко усваиваемых белков. Содержит полиненасыщенные жиры Омега-3. Регулярное употребление поможет нормализовать уровень холестерина. Также благоприятно влияет на сердечно-сосудистую систему, улучшает работу головного мозга. Снижает риск развития атеросклероза, гипертонии, раковых заболеваний. Содержит витамины группы В, А (большое количество), минеральные вещества: магний железо, фосфор, калий, кальций.
Пикша;-;НЕТ;Пикша богата протеинами, витамином В12 и селеном. Также содержит пиридоксин, натрий, калий, бром, железо, цинк, йод, фтор, витамины группы В, а также А и D.
Плотва;-;НЕТ;Содержит ценный белок и аминокислоты, которые очень легко усваиваются.
Раки;-;ДА;Содержит большое количество белка, легко усваивается. Стимулирует работу имунной системы. Профилактическое средство при заболеваниях сердечно-сосудистой системы и печени. Минеральные вещества: фтор, хром,хлор, фосфор, калий, натрий, кальций.
Ряпушка;-;ДА;В ней совсем мало костей. Содержит полиненасыщенные жирные кислоты Омега-3, витамин РР. Минеральные вещества: никель, молибден, фтор, хром, цинк, сера, хлор, кальций, магний. Благотворно влияет на иммунную, нервную системы, работу сердца и головного мозга.
Сазан;-;ДА;Содержит важные белки, жиры, золы, воды, насыщенные жирные кислоты, витамины А, С, Е, РР и группы В (В1 - тиамин и В2 - рыбофламин), а также ролноценный комплекс макро- и микроэлементов: фосфор, магний, кальций, фтор, хром, калий, молибден, натрий, никель, хлор.
Салака;1;ДА;В состав входят Омега-3 жирные кислоты, способные регулировать уровень холестерина в крови. Богата витаминами - А, В1, В2, В6, В12, С и Е, а также йодом, кальцием, фосфором и магнием.
Семга;1;ДА;Богата полиненасыщенными жирными кислотами, предупреждающими развитие атеросклероза и др. сердечно-сосудистых заболеваний, нормализующие уровень холестерина в крови. Протеины этой рыбы легко усваиваются и помогают восстановить силы после тяжелых заболеваний, операций и физических нагрузок. Регулярное употребление улучшает функциональное состояние головного мозга, повышает настроение, укрепляет стенки кровеносных сосудов и снижает риск возрастных изменений головного мозга. В  семге содержится около 20 необходимых человеческому организму минеральных веществ (магний, кальций, калий, сера, хлор, никель и др.) и витамины А, С, В, РР, Н и D, способные снять воспаление, укрепить мышечную и костную ткань и уменьшить количество жировых подкожных отложений.
Сиг;1;ДА;Отличается высоким уровнем содержания жира. Но в этом жире и состоит основная польза сига, рыбий жир отлично усваивается организмом человека, а также приносит огромную пользу желудочно-кишечному тракту. Витамины, как: А и D – отвечают за хорошее зрение и крепкие кости.
Скумбрия;1;ДА;Считается довольно жирной рыбой, но при этом безумно полезной. Является кладезем минеральных веществ. Содержит фтор, цинк, фосфор, калий, марганец, сера, натрий и др. Витамины: А, РР, С и группы В, в наибольшем количестве В12. Он принимает участие в метаболизме жиров. Скумбрия очень полезна для детей (правильного роста и гармоничного развития). Рекомендуют и для рациона беременных женщин и кормящих матерей, поскольку она способствует лактации.
Сом;-;ДА;Содержит витамины группы В, А, С, РР, Е, микро- и макроэлементы (кальций, калий, марганец, железо, йод, цинк, магний, натрий, хлор, медь, хром, кобальт, никель, хром, фтор), протеины и аминокислоты (особенно много в нем лизина). Всего 200 г мяса этой рыбы покрывает суточную потребность организма человека в белках животного происхождения.
Ставрида;-;НЕТ;Великолепный источник легкоусвояемого белка, кальция, фосфора, магния, железа, цинка и других морских минералов и витаминов, необходимых человеческому организму. Содержит полезные жирные кислоты Омега-3, которые благотворно влияют на работу сердечно-сосудистой системы, и показаны при атеросклерозе, ишемической болезни, гипертонии и нарушениях обмена веществ.
Стерлядь;-;ДА;Жирная рыба, но все жиры в ней исключительно полезные. Богата цинком, фтором, никелем и молибденом, а также витамином РР. Содержатся жирные омега-3 кислоты, благотворно воздействующие на мозговую деятельность и глазное кровообращение. Эти кислоты также помогают поддерживать в тонусе сердечнососудистую систему, уменьшают вероятность возникновения инфаркта и предупреждают появление онкологических заболеваний.
Судак;-;ДА;Нежирноя мясо, богатое витаминами А, группы В, РР, Е, С, микро и макроэлементами.
Таймень;-;НЕТ;В мясе тайменя содержатся жирные кислоты Омега-3, препятствующие образованию бляшек в сосудах и нормализующие уровень холестерина в крови. Витамины: РР, А, В12, D. Минеральные вещества: никель, молибден, фтор, хром, цинк, сера, хлор.
Тилапия;-;ДА;Содержится сбалансированный белок, витамины: РР, В1, В2, В5, В6, В9, В12, Е, К, минеральные вещества: калий, кальций, магний, натрий, фосфор, железо.
Треска;-;ДА;Низкокалорийное мясо, богато легкоусвояемыми белками, витаминами группы В (особенно В6 и В12), селеном, фтором, фосфором и др. Содержащиеся в треске Омега-3 жирные кислоты благотворно сказываются на работе сердечно-сосудистой и нервной систем, нормализуют обмен веществ и укрепляет иммунитет, защищая организм от инфекционных и простудных заболеваний. Очень полезной считается икра трески. Она богата белками, витаминами А и В и многими микроэлементами.
Тунец;-;ДА;Стимулирует обмен веществ, нормализует уровень сахара в крови и способствует выводу холестерина, часто рекомендуют гипертоникам. Также полезен для восстановления и улучшения свойств слизистых оболочек и кожи человека, особенно – при экземе. Содержит жирные кислоты Омега-3, которые сокращают риск сердечно-сосудистых заболеваний, нормализуют уровень холестерина в крови. Является хорошей профилактикой развития онкологических заболеваний. Улучшает зрение, нормализует уровень сахара в крови. Витамины: РР, Е, В9, В6, В2, В1, А. Минеральные вещества: никель, молибден, фтор, хром, железо, хлор, фосфор, йод, магний, кальций, железо и др. Нельзя употреблять при почечной недостаточности. Не рекомендуется маленьким детям, беременным и кормящим женщинам.
Угорь морской;-;ДА;Мясо морского угря примерно в 3 раза менее калорийно, чем его речного собрата, за счет пониженного содержания жиров, а вот витаминов (А) микро и макро элементов там предостаточно.
Улитки;-;НЕТ;Состоит из полиненасыщенных и ненасыщенных жирных кислот, содержит не менее 15 процентов белка. Минеральные вещества: магний, натрий, калий, фосфор, медь.
Устрицы;-;НЕТ;Содержание витаминов (А), минералов (фтор, хром, хлор, фосфор, калий, натрий, кальций), жиров и белка способно удовлетворить суточную потребность организма в необходимых веществах. Также содержит кислоту омега-3.
Форель;2;ДА;Свойства аналогичны семге
Хариус;-;НЕТ;Содержит белок, витамины РР, микро и макроэлементы ( сера, хлор, никель, молибден, фтор, хром, цинк), полиненасыщенные жирные кислоты, все в прекрасном соотношении.
Хек;-;ДА;Легкоусвояемое мясо, богато белками, витаминами А, Е, С, РР и группы В, а также микро- и макроэлементами: фосфор, магний, медь, йод, кальций, натрий, калий, марганец, железо, сера, цинк, фтор. Способствует регулированию обмена веществ и уровня сахара в крови, помогает выводить из организма токсины,предупреждает развитие раковых заболеваний. Обладает антиоксидантными свойствами и очень полезен для кожи, щитовидной железы, слизистых оболочек, пищеварительной и нервной систем.
Щука;-;ДА;Нежирная, содержит много биологически ценного протеина, хорошо усвояемого организмом человека, витамины группы В, А, С, Е, железо, цинк, йод, марганец, медь, хром, фтор, кобальт, молибден и никель. Полезна людям с заболеваниями желудочно-кишечного тракта, гиповитаминозами, ожирением и сердечно-сосудистыми болезнями. Укрепляет иммунную систему и помогает справиться с бактериальными инфекциями.
Язь;-;ДА;Быстро и легко усваивается. Полезна при различных заболеваниях сердца и сосудов, при язве желудка и гастрите. Отлично стимулирует пищеварение. Экстрактивные вещества бульона из язя  вызывают повышенное выделение ферментов поджелудочной железы и желудочного сока. Полезно для больных гастритом с пониженной кислотностью. Содержит белок с уникальным сочетанием незаменимых аминокислот, кальций и фосфор.
